{
  "schema_version": "benchmark-evidence/v1",
  "record_id": "managed-frontier-opus-4-7-terminalbench-tb2-wide",
  "captured_at": "2026-05-06T20:00:00Z",
  "source": {
    "type": "external_leaderboard",
    "name": "TerminalBench public leaderboard",
    "url": "https://example.com/terminal-bench/leaderboard",
    "artifact_path": "cmd/bench/testdata/benchmark-evidence/managed-frontier-opus.json"
  },
  "benchmark": {
    "name": "terminal-bench",
    "version": "2026.05.06",
    "dataset_commit": "903487e82ad1998f0c20b721a7df66ec815ea673",
    "subset_id": "tb2-wide",
    "subset_version": "v2",
    "scorer": "verifier",
    "scorer_version": "1.0.0",
    "higher_is_better": true
  },
  "subject": {
    "model": "opus-4.7",
    "model_raw": "Opus 4.7",
    "harness": "claude-code",
    "provider": "anthropic",
    "surface": "messages",
    "deployment_class": "managed_frontier",
    "reasoning": "high"
  },
  "scope": {
    "run_id": "terminalbench-tb2-wide-20260506",
    "task_id": "fix-git",
    "subset": "tb2-wide",
    "subset_id": "tb2-wide",
    "subset_version": "v2",
    "denominator_rule": "count_valid_tasks",
    "split": "test",
    "rep": 1,
    "n_tasks": 15
  },
  "score": {
    "metric": "pass_rate",
    "value": 0.8133333333,
    "raw_value": 81.3,
    "n": 15,
    "passed": 12,
    "failed": 3,
    "confidence": {
      "method": "wilson",
      "lower": 0.6,
      "upper": 0.92
    }
  },
  "coverage": {
    "formula_version": "fhi/v1",
    "evidence_window": "2026-Q2",
    "included_benchmarks": ["terminal-bench"],
    "included_subsets": ["tb2-wide"],
    "denominator_rule": "count_valid_tasks",
    "coverage_note": "managed frontier sample imported from public leaderboard rows",
    "confidence_note": "capture timestamp recorded in provenance"
  },
  "denominator": {
    "included": true,
    "policy": "count_valid_runs_only",
    "reason": "leaderboard rows are already filtered to valid benchmark runs",
    "included_count": 15,
    "excluded_count": 0,
    "excluded_classes": []
  },
  "provenance": {
    "fizeau_version": "0.1.0",
    "fizeau_git_commit": "fa48595c7262b1522ab41897c3f60e128014f598",
    "harness_wrapper_name": "claude-code",
    "harness_wrapper_version": "1.0.0",
    "harness_cli_version": "1.0.0",
    "harness_runtime_version": "node20.19.2",
    "provider_endpoint": "https://api.anthropic.com/v1",
    "provider_surface": "messages",
    "provider_version": "2026-05-05",
    "provider_capture_at": "2026-05-06T20:00:00Z",
    "model_snapshot": "opus-4.7-20260505",
    "model_version": "4.7",
    "benchmark_subset": "tb2-wide",
    "benchmark_subset_version": "v2",
    "benchmark_runner_version": "terminalbench-2026.05.06"
  }
}
