{
  "schema_version": "benchmark-evidence/v1",
  "record_id": "local-omlx-qwen3-6-27b-mlx-8bit-terminalbench-tb2-wide",
  "captured_at": "2026-05-06T20:10:00Z",
  "source": {
    "type": "fizeau_runner",
    "name": "Fizeau matrix run",
    "url": "https://example.com/fizeau/matrix/20260506",
    "artifact_path": "cmd/bench/testdata/benchmark-evidence/local-omlx-qwen.json",
    "artifact_sha256": "1111111111111111111111111111111111111111111111111111111111111111"
  },
  "benchmark": {
    "name": "terminal-bench",
    "version": "2026.05.06",
    "dataset_commit": "903487e82ad1998f0c20b721a7df66ec815ea673",
    "subset_id": "tb2-wide",
    "subset_version": "v2",
    "scorer": "verifier",
    "scorer_version": "1.0.0",
    "higher_is_better": true
  },
  "subject": {
    "model": "qwen3.6-27b",
    "model_raw": "Qwen3.6-27B-MLX-8bit",
    "harness": "fiz",
    "provider": "omlx",
    "endpoint": "http://vidar:1235/v1",
    "surface": "openai-compat",
    "deployment_class": "local",
    "reasoning": "high"
  },
  "scope": {
    "run_id": "terminalbench-tb2-wide-20260506-local-omlx",
    "task_id": "fix-git",
    "subset": "tb2-wide",
    "subset_id": "tb2-wide",
    "subset_version": "v2",
    "denominator_rule": "count_valid_tasks",
    "split": "test",
    "rep": 1,
    "n_tasks": 15
  },
  "score": {
    "metric": "pass_rate",
    "value": 0.5,
    "raw_value": 50,
    "n": 15,
    "passed": 7,
    "failed": 8,
    "confidence": {
      "method": "wilson",
      "lower": 0.27,
      "upper": 0.73
    }
  },
  "coverage": {
    "formula_version": "fhi/v1",
    "evidence_window": "2026-Q2",
    "included_benchmarks": ["terminal-bench"],
    "included_subsets": ["tb2-wide"],
    "denominator_rule": "count_valid_tasks",
    "coverage_note": "local oMLX sample with versioned runtime metadata",
    "confidence_note": "session and trajectory hashes present"
  },
  "denominator": {
    "included": true,
    "policy": "count_valid_runs_only",
    "reason": "this sample represents a valid benchmark run",
    "included_count": 15,
    "excluded_count": 0,
    "excluded_classes": []
  },
  "runtime": {
    "deployment_class": "local",
    "quantization": "8-bit",
    "local_runtime_name": "omlx",
    "local_runtime_version": "0.8.10",
    "server_name": "vidar",
    "server_version": "0.8.10",
    "context_limit": 131072,
    "hardware_class": "Mac Studio",
    "hardware_accelerator": "Apple GPU",
    "hardware_accelerator_backend": "mlx",
    "hardware_memory_gb": 512,
    "hardware_os": "macOS 15.5",
    "hardware_arch": "arm64",
    "sampling_temperature": 0.2,
    "sampling_top_p": 0.9,
    "sampling_reasoning": "high",
    "utilization_active_requests": 1,
    "utilization_queue_depth": 0,
    "utilization_memory_pressure": 0.34,
    "utilization_tokens_per_second": 18.5
  },
  "provenance": {
    "fizeau_version": "0.1.0",
    "fizeau_git_commit": "fa48595c7262b1522ab41897c3f60e128014f598",
    "harness_wrapper_name": "fiz-native",
    "harness_wrapper_version": "1.0.0",
    "harness_cli_version": "0.67.1",
    "harness_runtime_version": "go1.26.2",
    "provider_endpoint": "http://vidar:1235/v1",
    "provider_surface": "openai-compat",
    "provider_version": "0.8.10",
    "provider_capture_at": "2026-05-06T20:10:00Z",
    "model_snapshot": "qwen3.6-27b-mlx-8bit@0.8.10",
    "model_version": "Qwen3.6-27B-MLX-8bit",
    "model_artifact_path": "/models/qwen3.6-27b-mlx-8bit",
    "model_artifact_sha256": "2222222222222222222222222222222222222222222222222222222222222222",
    "session_log_path": "benchmark-results/evidence/local-omlx-qwen/session.log.jsonl",
    "session_log_sha256": "3333333333333333333333333333333333333333333333333333333333333333",
    "trajectory_path": "benchmark-results/evidence/local-omlx-qwen/trajectory.json",
    "trajectory_sha256": "4444444444444444444444444444444444444444444444444444444444444444",
    "benchmark_subset": "tb2-wide",
    "benchmark_subset_version": "v2",
    "benchmark_runner_version": "harbor-0.20.0"
  }
}
